<?xml version="1.0" encoding="UTF-8"?>
<circuito xmlns="http://www.uniovi.es"
	xmlns:xsi="http://www.w3.org/2001/XMLSchema-instance"
	xsi:schemaLocation="http://www.uniovi.es circuito.xsd">

	<nombre>Circuito Internazionale del Mugello</nombre>

	<longitud unidad="m">5243.0</longitud>
	<anchura unidad="m">14.0</anchura>

	<fecha>2025-05-11</fecha>
	<hora>14:00:00</hora>

	<numVueltas>23</numVueltas>

	<localidad>Scarperia e San Piero</localidad>
	<pais>Italia</pais>

	<patrocinador>Ducati</patrocinador>

	<referencias>
		<referencia url="https://www.motogp.com/en/circuit/Mugello">
			<titulo>MotoGP Official - Mugello circuit information</titulo>
			<autor>MotoGP</autor>
			<año>2024</año>
		</referencia>
		<referencia url="https://es.wikipedia.org/wiki/Autodromo_Internazionale_del_Mugello">
			<titulo>Wikipedia - Autodromo Internazionale del Mugello</titulo>
			<autor>Wikipedia</autor>
			<año>2025</año>
		</referencia>
		<referencia url="https://www.fim-moto.com">
			<titulo>FIM - Circuit technical data and map</titulo>
			<autor>FIM</autor>
			<año>2023</año>
		</referencia>
	</referencias>

	<galeriaFotos>
		<foto src="../multimedia/Panorama.jpg" alt="Foto panorámica del circuito"/>
		<foto src="../multimedia/RectaMeta.jpg" alt="Foto de la recta de meta del circuito"/>
		<foto src="../multimedia/CurvaSanDonato.jpg" alt="Foto de la curva San Donato del circuito"/>
	</galeriaFotos>

	<galeriaVideos>
		<video src="../multimedia/ResumenCircuito.mp4" alt="Video del resumen del circuito"/>
	</galeriaVideos>

	<origen>
		<longitudCoord unidad="deg">11.3497</longitudCoord>
		<latitudCoord unidad="deg">43.9972</latitudCoord>
		<altitudCoord unidad="m">210.0</altitudCoord>
	</origen>

	<tramos>
		<tramo distancia="650.0">
			<puntoFinal>
				<longFinal unidad="deg">11.3521</longFinal>
				<latFinal unidad="deg">43.9980</latFinal>
				<altFinal unidad="m">212.0</altFinal>
			</puntoFinal>
			<sector>1</sector>
		</tramo>

		<tramo distancia="840.0">
			<puntoFinal>
				<longFinal unidad="deg">11.3540</longFinal>
				<latFinal unidad="deg">44.0002</latFinal>
				<altFinal unidad="m">218.0</altFinal>
			</puntoFinal>
			<sector>1</sector>
		</tramo>

		<tramo distancia="1200.0">
			<puntoFinal>
				<longFinal unidad="deg">11.3458</longFinal>
				<latFinal unidad="deg">44.0010</latFinal>
				<altFinal unidad="m">205.0</altFinal>
			</puntoFinal>
			<sector>2</sector>
		</tramo>

		<tramo distancia="1553.0">
			<puntoFinal>
				<longFinal unidad="deg">11.3497</longFinal>
				<latFinal unidad="deg">43.9972</latFinal>
				<altFinal unidad="m">210.0</altFinal>
			</puntoFinal>
			<sector>3</sector>
		</tramo>
	</tramos>

	<vencedor>
		<nombreVencedor>Marc Marquez</nombreVencedor>
		<duracion>PT41M9.214S</duracion>
	</vencedor>

	<clasificacion>
		<puesto pos="1">
			<piloto>Marc Marquez</piloto>
			<puntos>25</puntos>
		</puesto>
		<puesto pos="2">
			<piloto>Alex Marquez</piloto>
			<puntos>20</puntos>
		</puesto>
		<puesto pos="3">
			<piloto>Francesco Bagnaia</piloto>
			<puntos>16</puntos>
		</puesto>
	</clasificacion>

</circuito>
